Unnamed: 0.1,Unnamed: 0,course_code,course_name,units,description,requirements,faculty,outcomes,prerequisites,corequisites,exclusions,recommended,department_name,year,department_code,instructor
36,12,ARTH 215,"Humanity and Divinity in Renaissance Art, 1500-1600",3.0,"By examining the variety and complexity of Renaissance art, from Michelangelo's muscular giants to Bosch's perversely playful monsters, this course explores how Renaissance artists and their patrons understood what it means to be human and how they imagined in new ways God, Heaven, Hell, and angels (genderless and bodiless beings). By discussing both such famous works as Leonardo da Vinci's Mona Lisa and such little-known ones as prints of witches, we will study ideals of gender, constructions of power, and depictions of marginalized peoples.",Prerequisite (Level 2 or above) or permission of the Department.,Faculty of Arts and Science,,(Level 2 or above) or permission of the Department.,,,,Art History,2.0,ARTH,
37,13,ARTH 220,Socially Engaged Art,3.0,"An introduction to socially engaged art around the world. Using a case study approach, the course will consider the role of art and artists within social movements and study the practices of individual artists or collectives who use their work as a tool for social change.",Prerequisite Level 2 or above.,Faculty of Arts and Science,,Level 2 or above.,,,,Art History,2.0,ARTH,Jennifer Kennedy
38,14,ARTH 222,Impressionism and Post-Impressionism,3.0,"This course offers a unique opportunity to study the art of Manet, Degas, Monet and Van Gogh, where many of the paintings studied will be viewed on gallery visits to London and Paris. Some of the classes will take place in the Musée D'Orsay in Paris and the National Gallery and Courtauld Institute in London. Further classes at Herstmonceux Castle explore gender debates, the French nude and Paris as the fashionable centre of modernity.
NOTE Only offered at Bader College, UK. Students must participate in field trips.",Prerequisite (Level 2 or above) or permission of the Department.,Faculty of Arts and Science,,(Level 2 or above) or permission of the Department.,,,,Art History,2.0,ARTH,
39,15,ARTH 225,Fashion and Art: From the Renaissance to the Present,3.0,"This course considers the relationship between the fashion and art from the Renaissance to the present. Through an exploration of objects and images, it examines social and cultural changes in Western dress, artists' use of clothing to construct narratives, and fashion itself as a form of artistic representation.",Prerequisite (Level 2 or above) or permission of the Department. Recommended ARTH 120.,Faculty of Arts and Science,,(Level 2 or above) or permission of the Department.,,,ARTH 120.,Art History,2.0,ARTH,
40,16,ARTH 226,Modern Arts in a Globalizing World,3.0,"This course examines the histories, meanings, and sites of modern arts in a globalizing world. Students become familiar with key art works, transnational and global networks of art, shifts in critical conceptions, and art historical problems surrounding modernity, modernisms, and modern arts.",Prerequisite (Level 2 or above) or permission of the Department.,Faculty of Arts and Science,,(Level 2 or above) or permission of the Department.,,,,Art History,2.0,ARTH,
41,17,ARTH 228,Contemporary Art in a Globalizing World,3.0,"This course will examine the histories, meanings and sites of contemporary art in a globalizing world. Students will become familiar not only with the works themselves, but with shifts in critical conceptions and popular media that affect the production, display, circulation, and reception of contemporary art.",Prerequisite (Level 2 or above) or permission of the Department.,Faculty of Arts and Science,,(Level 2 or above) or permission of the Department.,,,,Art History,2.0,ARTH,
42,18,ARTH 232,Art in Canada,3.0,"An introduction to the histories of Indigenous and settler art in Canada from pre-contact to the end of the 20th century. Through close study of visual and material culture, students will become familiar not only with the works themselves, but with the historical, cultural, political, and social contexts of their production and reception.",Prerequisite (Level 2 or above) or permission of the Department.,Faculty of Arts and Science,,(Level 2 or above) or permission of the Department.,,,,Art History,2.0,ARTH,
43,19,ARTH 234,Introduction to African Arts,3.0,"An introduction to the arts and visual culture of Africa, encompassing traditional or classic African arts, as well as modern and contemporary artists. The course also examines how the African art field was shaped, and its critical turning points.",Prerequisite (Level 2 or above) or permission of the Department.,Faculty of Arts and Science,,(Level 2 or above) or permission of the Department.,,,,Art History,2.0,ARTH,
44,20,ARTH 242,Introduction to History of Photography,3.0,"An introduction to the history of photography as technology, art, and social practice. Within the larger historical contexts of society and culture, this course surveys key developments and applications in France, England, and the United States, and their spread to other parts of the world, and considers the work of major photographers and their influence.",Prerequisite (Level 2 or above) or permission of the Department.,Faculty of Arts and Science,,(Level 2 or above) or permission of the Department.,,,,Art History,2.0,ARTH,
45,21,ARTH 245,Art and Architecture in Venice,6.0,"Instruction in Venice based on daily study tours to the city's monuments and galleries. Each week a visit will be organized to an important centre in the Venice region.
NOTE Costs of travel and accommodation abroad must be paid by the student. Consult the Department for the costs involved.",Prerequisite A minimum of 6.0 units in ARTH.,Faculty of Arts and Science,,A minimum of 6.0 units in ARTH.,,,,Art History,2.0,ARTH,
46,22,ARTH 248,Introduction to Indigenous Arts of North America,3.0,"An introduction to the arts and visual culture of the Indigenous peoples of North America from north of the Rio Grande to the Arctic, encompassing pre-history, colonialism, and the modern period. Key works from six regional zones are studied in their historical and cultural contexts.",Prerequisite (Level 2 or above) or permission of the Department.,Faculty of Arts and Science,,(Level 2 or above) or permission of the Department.,,,,Art History,2.0,ARTH,Norman Vorano
47,23,ARTH 250,"Art, Society, and Culture",3.0,"An introduction to the social conditions and cultural movements that shaped European visual art of the nineteenth century in its global context. The course will stress the tension between modernity and anti-modernism as well as competing views on the very nature of visual art.
NOTE Only offered online, consult Arts and Science Online.",Prerequisite (Level 2 or above) or permission of the Department. Exclusion ARTH 223/3.0.,Faculty of Arts and Science,,(Level 2 or above) or permission of the Department.,,ARTH 223/3.0.,,Art History,2.0,ARTH,
48,24,ARTH 253,Baroque Art,3.0,"A survey of the visual culture of Europe and its colonies in the Baroque age (ca. 1580-1750). Attention is given to developments in all aspects of the visual arts, with emphasis on painting, sculpture, architecture, and the graphic arts, and on the achievements of artists such as Rembrandt, Rubens, Poussin, Velasquez, and Bernini.",Prerequisite (Level 2 or above) or permission of the Department.,Faculty of Arts and Science,,(Level 2 or above) or permission of the Department.,,,,Art History,2.0,ARTH,Gauvin Bailey
49,25,ARTH 260,Culture and Conflict,3.0,"An investigation of the impact of war on art and architecture, as well as human attempts to preserve cultural heritage. A chronological or thematic approach may be taken, with focus placed on one or more case studies, such as: the Sacks of Rome, the Napoleonic wars, Nazi looting, the Cultural Revolution in China, and Afghanistan under Taliban rule.",Prerequisite (Level 2 or above) or permission of the Department.,Faculty of Arts and Science,,(Level 2 or above) or permission of the Department.,,,,Art History,2.0,ARTH,Cathleen Hoeniger
2910,1,SOFT 437,Performance Analysis,3.0,"Analytic and empirical evaluation of the performance of software systems. Performance modeling. Experimental design and statistical techniques for empirical performance analysis. Alternately offered as CISC 437.
(Lec: 3, Lab: 0, Tut: 0)","Prerequisites: CMPE 324 (CISC 324) or ELEC 377, or permission of the instructor Corequisites: Exclusio",Smith Engineering,,"CMPE 324 (CISC 324) or ELEC 377, or permission of the instructor",,,,Software Engineering,4.0,SOFT,Samir Mohammad
